"","DOI","ArticleTitle","Abstract","experiment_abstract","observation_abstract","total_positive_count_abstract","observation_title","experiment_title","total_positive_count_title","river_abstract","modeling_abstract","aquatic_abstract","greenhouse_abstract","review_abstract","marine_abstract","meta_analysis_abstract","modelling_abstract","coral_abstract","incubation_abstract","total_negative_count_abstract","river_title","modeling_title","review_title","aquatic_title","meta_analysis_title","marine_title","coral_title","greenhouse_title","modelling_title","incubation_title","total_negative_count_title","total_positive_count","total_negative_count","final_score","Evaluator","Include"
"1","10.2151/jmsj.2011-104","A Numerical Investigation of Changes in Energy and Carbon Cycle Balances under Vegetation Transition due to Deforestation in the Asian Tropical Region","Temporal progress of forest reduction by deforestation in the Asian tropical region was simulated using a global climate model that included a new land-surface ecosystem model. The horizontal resolution of the model was 1.875. Two experimental areas were defined: the Indochina peninsula (ICP) area, and the Maritime Continent (MTC) area. With a control simulation under the actual vegetation condition, a grassland experiment (C4 experiment) and a bare-soil experiment (BS experiment) were carried out. Forest vegetation in the experimental areas was gradually changed (at the latest actual rate) to non-forest type vegetation. The natural growth of C4 grass was reproduced in the C4 experiment, and the plant growth was deterred in the BS experiment. Each experiment was run for 100 model years. Temporal changes of the energy and the carbon cycle balances under the vegetation transition were examined. Compared with the control, the net radiation (RNE) decreased because of the increase in the land surface albedo. The sensible heat flux decreased because of the decreases in RNE and other particular reasons. The results for latent heat flux (E) in this study differed from those in our previous study. In the C4 experiment, E increased, especially in the ICP area; in the BS experiment, E decreased in both experimental areas. In the MTC area, the surface temperature in the C4 experiment increased because of the large influence of decreased precipitation. Decreases of the soil wetness in the C4 experiment were more significant in the MTC area, due to increased transpiration and the decreased precipitation. The change from forest vegetation to C4 grass vegetation induced the reduction of carbon absorption by the land surface. Continuous deforestation in the Asian tropical region certainly induces the elevations of the global atmospheric carbon dioxide concentrations, even if the deforested area is not replaced by bare soil surface condition.",14,0,14,0,0,0,0,0,0,0,0,0,0,0,0,0,0,0,0,0,0,0,0,0,0,0,0,0,14,0,14,NA,NA
"2","10.1002/ece3.2729","Methods to test the interactive effects of drought and plant invasion on ecosystem structure and function using complementary common garden and field experiments","Abiotic global change drivers affect ecosystem structure and function, but how they interact with biotic factors such as invasive plants is understudied. Such interactions may be additive, synergistic, or offsetting, and difficult to predict. We present methods to test the individual and interactive effects of drought and plant invasion on native ecosystems. We coupled a factorial common garden experiment containing resident communities exposed to drought (imposed with rainout shelters) and invasion with a field experiment where the invader was removed from sites spanning a natural soil moisture gradient. We detail treatments and their effects on abiotic conditions, including soil moisture, light, temperature, and humidity, which shape community and ecosystem responses. Ambient precipitation during the garden experiment exceeded historic norms despite severe drought in prior years. Soil moisture was 48% lower in drought than ambient plots, but the invader largely offset drought effects. Additionally, temperature and light were lower and humidity higher in invaded plots. Field sites spanned up to a 10-fold range in soil moisture and up to a 2.5-fold range in light availability. Invaded and resident vegetation did not differentially mediate soil moisture, unlike in the garden experiment. Herbicide effectively removed invaded and resident vegetation, with removal having site-specific effects on soil moisture and light availability. However, light was generally higher in invader-removal than control plots, whereas resident removal had less effect on light, similar to the garden experiment. Invasion mitigated a constellation of abiotic conditions associated with drought stress in the garden experiment. In the field, where other factors co-varied, these patterns did not emerge. Still, neither experiment suggested that drought and invasion will have synergistic negative effects on ecosystems, although invasion can limit light availability. Coupling factorial garden experiments with field experiments across environmental gradients will be effective for predicting how multiple stressors interact in natural systems.",9,0,9,0,1,1,0,0,0,0,0,0,0,0,0,0,0,0,0,0,0,0,0,0,0,0,0,0,10,0,10,"Carmen","Yes"
"3","10.5194/bg-11-2991-2014","Can current moisture responses predict soil CO2 efflux under altered precipitation regimes? A synthesis of manipulation experiments","As a key component of the carbon cycle, soil CO2 efflux (SCE) is being increasingly studied to improve our mechanistic understanding of this important carbon flux. Predicting ecosystem responses to climate change often depends on extrapolation of current relationships between ecosystem processes and their climatic drivers to conditions not yet experienced by the ecosystem. This raises the question of to what extent these relationships remain unaltered beyond the current climatic window for which observations are available to constrain the relationships. Here, we evaluate whether current responses of SCE to fluctuations in soil temperature and soil water content can be used to predict SCE under altered rainfall patterns. Of the 58 experiments for which we gathered SCE data, 20 were discarded because either too few data were available or inconsistencies precluded their incorporation in the analyses. The 38 remaining experiments were used to test the hypothesis that a model parameterized with data from the control plots (using soil temperature and water content as predictor variables) could adequately predict SCE measured in the manipulated treatment. Only for 7 of these 38 experiments was this hypothesis rejected. Importantly, these were the experiments with the most reliable data sets, i.e., those providing high-frequency measurements of SCE. Regression tree analysis demonstrated that our hypothesis could be rejected only for experiments with measurement intervals of less than 11 days, and was not rejected for any of the 24 experiments with larger measurement intervals. This highlights the importance of high-frequency measurements when studying effects of altered precipitation on SCE, probably because infrequent measurement schemes have insufficient capacity to detect shifts in the climate dependencies of SCE. Hence, the most justified answer to the question of whether current moisture responses of SCE can be extrapolated to predict SCE under altered precipitation regimes is 'no' - as based on the most reliable data sets available. We strongly recommend that future experiments focus more strongly on establishing response functions across a broader range of precipitation regimes and soil moisture conditions. Such experiments should make accurate measurements of water availability, should conduct high-frequency SCE measurements, and should consider both instantaneous responses and the potential legacy effects of climate extremes. This is important, because with the novel approach presented here, we demonstrated that, at least for some ecosystems, current moisture responses could not be extrapolated to predict SCE under altered rainfall conditions.",8,1,9,0,1,1,0,0,0,0,0,0,0,0,0,0,0,0,0,0,0,0,0,0,0,0,0,0,10,0,10,"Carmen","No"
"4","10.1016/J.ENG.2017.03.018","Methane Emissions from Grazing Holstein-Friesian Heifers at Different Ages Estimated Using the Sulfur Hexafluoride Tracer Technique","Although the effect of animal and diet factors on enteric methane (CH4) emissions from confined cattle has been extensively examined, less data is available regarding CH4 emissions from grazing young cattle. A study was undertaken to evaluate the effect of the physiological state of Holstein-Friesian heifers on their enteric CH4 emissions while grazing a perennial ryegrass sward. Two experiments were conducted: Experiment 1 ran from May 2011 for 11 weeks and Experiment 2 ran from August 2011 for 10 weeks. In each experiment, Holstein-Friesian heifers were divided into three treatment groups (12 animals/group) consisting of calves, yearling heifers, and in-calf heifers (average ages: 8.5, 14.5, and 20.5 months, respectively). Methane emissions were estimated for each animal in the final week of each experiment using the sulfur hexafluoride tracer technique. Dry matter (DM) intake was estimated using the calculated metabolizable energy (ME) requirement divided by the ME concentration in the grazed grass. As expected, live weight increased with increasing animal age (P < 0.001); however, there was no difference in live weight gain among the three groups in Experiment 1, although in Experiment 2, this variable decreased with increasing animal age (P < 0.001). In Experiment 1, yearling heifers had the highest CH4 emissions (g.d(-1)) and in-calf heifers produced more than calves (P < 0.001). When expressed as CH4 emissions per unit of live weight, DM intake, and gross energy (GE) intake, yearling heifers had higher emission rates than calves and in-calf heifers (P < 0.001). However, the effects on CH4 emissions were different in Experiment 2, in which CH4 emissions (g.d(-1)) increased linearly with increasing animal age (P < 0.001), although the difference between yearling and in-calf heifers was not significant. The CH4/live weight ratio was lower in in-calf heifers than in the other two groups (P < 0.001), while CH4 energy output as a proportion of GE intake was lower in calves than in yearling and in-calf heifers (P < 0.05). All data were then pooled and used to develop prediction equations for CH4 emissions. All relationships are significant (P < 0.001), with R-2 values ranging from 0.630 to 0.682. These models indicate that CH4 emissions could be increased by 0.252 g.d(-1) with an increase of 1 kg live weight or by 14.9 g.d(-1) with an increase of 1 kg.d(-1) of DM intake; or, the CH4 energy output could be increased by 0.046 MJ.d(-1) with an increase of 1 MJ.d(-1) of GE intake. These results provide an alternative approach for estimating CH4 emissions from grazing dairy heifers when actual CH4 emission data are not available. (C) 2017 THE AUTHORS. Published by Elsevier LTD on behalf of the Chinese Academy of Engineering and Higher Education Press Limited Company. This is an open access article under the CC BY-NC-ND license (http://creativecommons.org/licenses/by-nc-nd/4.0/).",9,0,9,0,0,0,0,0,0,0,0,0,0,0,0,0,0,0,0,0,0,0,0,0,0,0,0,0,9,0,9,NA,NA
"5","10.1016/j.gecco.2019.e00864","Observational and experimental evidence for the effect of altered precipitation on desert and steppe communities","Changes in precipitation pattern are likely to affect the community structure and ecosystem function in drylands. Observational and experimental studies can provide insight into how plant community in desert and grassland ecosystems responds to precipitation changes, however, the studies combining both approaches are rare. Here, we reported the results of altered precipitation effects on desert-shrub community and steppe-grass community from both a natual precipitation gradient and an experiment manipulating precipitation in Inner Mongolia, northern China. We found that precipitation changes along the natural gradient could well explain species richness and aboveground plant biomass (AGB), inducing their positive relationships in shrub- or grass-dominated community. In the manipulative experiment, 40% and 60% increased precipitation increased species richness and Shannon's diversity in grass-dominated community, and 60% increased precipitation increased AGB in grass-dominated community, while 60% reduced precipitation decreased plant density and AGB in shrub and grass-dominated communities. Species richness, Shannon's diversity, plant density and AGB were positively related to increased precipitation in the manipulative experiment. The positive relationship between species richness and AGB in the grass-dominated community could be shaped by the manipulative precipitation gradient, but no significant relationship was found in the shrub-dominated community in the experiment. Our study highlights that species richness and AGB in desert and steppe community consistently respond to altered precipitation along the natural gradient and in experiment. Extreme drought or high precipitation-induced shifts of the composition and production of herbaceous plants in the shrub-dominated community can contribute to shape the positive associations of community structure and function with precipitation changes. The high vulnerability of grass-dominated community in response to precipitation extremes presents a great challenge to effectively manage steppe ecosystem in future repaid climate changes. (C) 2019 The Authors. Published by Elsevier B.V.",6,1,7,1,1,2,0,0,0,0,0,0,0,0,0,0,0,0,0,0,0,0,0,0,0,0,0,0,9,0,9,NA,NA
"6","10.1890/04-0922","Effects of biodiversity on ecosystem functioning: A consensus of current knowledge","Humans are altering the composition of biological communities through a variety of activities that increase rates of species invasions and species extinctions, at all scales, from local to global. These changes in components of the Earth's biodiversity cause concern for ethical and aesthetic reasons, but they also have a strong potential to alter ecosystem properties and the goods and services they provide to humanity. Ecological experiments, observations, and theoretical developments show that ecosystem properties depend greatly on biodiversity in terms of the functional characteristics of organisms present in the ecosystem and the distribution and abundance of those organisms over space and time. Species effects act in concert with the effects of climate, resource availability, and disturbance regimes in influencing ecosystem properties. Human activities can modify all of the above factors; here we focus on modification of these biotic controls. The scientific community has come to a broad consensus on many aspects of the relationship between biodiversity and ecosystem functioning, including many points relevant to management of ecosystems. Further progress will require integration of knowledge about biotic and abiotic controls on ecosystem properties, how ecological communities are structured, and the forces driving species extinctions and invasions. To strengthen links to policy and management, we also need to integrate our ecological knowledge with understanding of the social and economic constraints of potential management practices. Understanding this complexity, while taking strong steps to minimize current losses of species, is necessary for responsible management of Earth's ecosystems and the diverse biota they contain. Based on our review of the scientific literature, we are certain of the following conclusions: 1)Species' functional characteristics strongly influence ecosystem properties. Functional characteristics operate in a variety of contexts, including effects of dominant species, keystone species', ecological engineers, and interactions among species (e.g., competition, facilitation, mutualism, disease, and predation). Relative abundance alone is not always a good predictor of the ecosystem-level importance of a species, as even relatively rare species (e.g., a keystone predator) can strongly influence pathways of energy and material flows. 2) Alteration of biota in ecosystems via species invasions and extinctions caused by human activities has altered ecosystem goods and services in many well-documented cases. Many of these changes are difficult, expensive, or impossible to reverse or fix with technological solutions. 3) The effects of species loss or changes in composition, and the mechanisms by which the effects manifest themselves, can differ among ecosystem properties, ecosystem types, and pathways of potential community change. 4) Some ecosystem properties are initially insensitive to species loss because (a) ecosystems may have multiple species that carry out similar functional roles, (b) some species may contribute relatively little to ecosystem properties, or (c) properties may be primarily controlled by abiotic environmental conditions. 5) More species are needed to insure a stable supply of ecosystem goods and services as spatial and temporal variability increases, which typically occurs as longer time periods and larger areas are considered. We have high confidence in the following conclusions: 1) Certain combinations of species are complementary in their patterns of resource use and can increase average rates of productivity and nutrient retention. At the same time, environmental conditions can influence the importance of complementarity in structuring communities. Identification of which and how many species act in a complementary way in complex communities is just beginning. 2) Susceptibility to invasion by exotic species is strongly influenced by species composition and, under similar environmental conditions, generally decreases with increasing species richness. However, several other factors, such as propagule pressure, disturbance regime, and resource availability also strongly influence invasion success and often override effects of species richness in comparisons across different sites or ecosystems. 3) Having a range of species that respond differently to different environmental perturbations can stabilize ecosystem process rates in response to disturbances and variation in abiotic conditions. Using practices that maintain a diversity of organisms of different functional effect and functional response types will help preserve a range of management options. Uncertainties remain and further research is necessary in the following areas: 1) Further resolution of the relationships among taxonomic diversity, functional diversity, and community structure is important for identifying mechanisms of biodiversity effects. 2) Multiple trophic levels are common to ecosystems but have been understudied in biodiversity/ecosystem functioning research. The response of ecosystem properties to varying composition and diversity of consumer organisms is much more complex than responses seen in experiments that vary only the diversity of primary producers. 3) Theoretical work on stability has outpaced experimental, work, especially field research. We need long-term experiments to be able to assess temporal stability, as well as experimental perturbations to assess response to and recovery from a variety of disturbances. Design and analysis of such experiments must account for several factors that covary with species diversity. 4) Because biodiversity both responds to and influences ecosystem properties, understanding the feedbacks involved is necessary to integrate results from experimental communities with patterns seen at broader scales. Likely patterns of extinction and invasion need to be linked to different drivers of global change, the forces that structure communities, and controls on ecosystem properties for the development of effective management and conservation strategies. 5) This paper focuses primarily on terrestrial systems, with some coverage of freshwater systems, because that is where most empirical and theoretical study has focused. While the fundamental principles described here should apply to marine systems, further study of that realm is necessary. Despite some uncertainties about the mechanisms and circumstances under which diversity influences ecosystem properties, incorporating diversity effects into policy and management is essential, especially in making decisions involving large temporal and spatial scales. Sacrificing those aspects of ecosystems that are difficult or impossible to reconstruct, such as diversity, simply because we are not yet certain about the extent and mechanisms by which they affect ecosystem properties, will restrict future management options even further. It is incumbent upon ecologists to communicate this need, and the values that can derive from such a perspective, to those charged with economic and policy decision-making.",7,1,8,0,0,0,0,0,0,0,1,1,0,0,0,0,2,0,0,0,0,0,0,0,0,0,0,0,8,2,6,"Anny","No"
"7","10.1672/0277-5212(2001)021[0519:HCAVOT]2.0.CO;2","Hydrologic change and vegetation of tidal freshwater marshes: Field, greenhouse, and seed-bank experiments","Plant communities of tidal freshwater marshes fluctuate in composition seasonally and among years, but the influence of changes in hydrology on vegetation of these systems has not been examined. We investigated the effects of hydrology on vegetation of tidal freshwater marshes along the Patuxent River in Maryland, USA with a two-year field experiment, a one-year greenhouse experiment, and a seed-bank experiment. In the field experiment, sections of marsh soil and vegetation (sods) were elevated 10 cm, lowered 10 cm, or placed level with the marsh surface to simulate different hydrologic regimes. In the greenhouse experiment, sods were raised 10 cin above water surface (nonflooded) or flooded by 10 cm of water in tanks continuously, and in two other treatments changed from nonflooded to flooded or vice-versa after the first 35 days. For the seed-bank experiment, soil samples were spread in a 1-cm-thick layer in pans subjected to flooding by 3.5-4 cin of water or nonflooded but moist conditions in the greenhouse, and emerging seedlings counted. We found that lowering marsh sods by 10 cm (i.e., wetter conditions) in the field reduced plant species richness by 26% compared to the sods placed level with the marsh surface, while raising sods by 10 cm (drier conditions) increased richness by 42%. Total stem length of a majority of the most common species, as well as for all species combined, was more than twice as great in raised sods as in lowered sods. We observed similar patterns in richness and total stem length in the greenhouse study, where continuously nonflooded sods had almost twice the richness and 55% greater total stein length as continuously flooded sods. Sods that were flooded initially and then shifted to nonflooded conditions had richness and total stein length similar to the continuously flooded sods, while sods that were nonflooded initially and then flooded had richness and total stem length intermediate to continuously nonflooded and continuously flooded sods. In the field and greenhouse studies, species that are annual or annnual/perennial were more inhibited by flooding than were perennials. In the seedbank experiment, flooding reduced the number of species emerging by 50% and total densities of emerging seedlings by 80% compared to nonflooded conditions. Taken together, the results of the field, greenhouse, and seed-bank studies indicate that 3-10 cm of flooding can significantly reduce seedling recruitment and growth in many plant species of tidal freshwater marshes and result in lower plant diversity. The greenhouse study further indicates that shallow flooding early in the growing season can reduce the abundance of certain species, primarily annuals, for the remainder of the growing season, resulting in a less diverse community. These findings suggest that hydrology is a dominant environmental variable controlling interannual variation in plant species composition of tidal freshwater marshes. Additionally, this study suggests that small increases in frequency and duration of inundation, which might occur due to watershed land-use changes, sea-level rise, or land subsidence, will reduce the diversity of these plant communities.",7,0,7,0,1,1,1,0,0,7,0,0,0,0,0,0,8,0,0,0,0,0,0,0,1,0,0,1,8,9,-1,NA,NA
