"","DOI","ArticleTitle","Abstract","experiment_abstract","observation_abstract","total_positive_count_abstract","observation_title","experiment_title","total_positive_count_title","river_abstract","modeling_abstract","aquatic_abstract","greenhouse_abstract","review_abstract","marine_abstract","meta_analysis_abstract","modelling_abstract","coral_abstract","incubation_abstract","total_negative_count_abstract","river_title","modeling_title","review_title","aquatic_title","meta_analysis_title","marine_title","coral_title","greenhouse_title","modelling_title","incubation_title","total_negative_count_title","total_positive_count","total_negative_count","final_score","Evaluator","Include"
"8","10.1016/j.catena.2018.02.027","Effectiveness of prescribed fire to re-establish sagebrush steppe vegetation and ecohydrologic function on woodland-encroached sagebrush rangelands, Great Basin, USA: Part I: Vegetation, hydrology, and erosion responses","Pinyon (Pinus spp.) and juniper (Juniperus spp.) woodland encroachment has imperiled a broad ecological domain of the sagebrush steppe (Artemisia spp.) ecosystem in the Great Basin Region, USA. As these conifers increase in dominance on sagebrush rangelands, understory vegetation declines and ecohydrologic function can shift from biotic (vegetation) controlled retention of soil resources to abiotic (runoff) driven loss of soil resources and long-term site degradation. Scientists, public land management agencies, and private land owners are challenged with selecting and predicting outcomes to treatment alternatives to improve ecological structure and function on these rangelands. This study is the first of a two-part study to evaluate effectiveness of prescribed fire to re-establish sagebrush steppe vegetation and improve ecohydrologic function on mid- to late-succession pinyon-and juniper-encroached sagebrush sites in the Great Basin. We used a suite of vegetation and soil measures, small-plot (0.5 m(2) ) rainfall simulations, and overland flow experiments (9 m(2) ) to quantify the effects of tree removal by prescribed fire on vegetation, soils, and rainsplash, sheetflow, and concentrated flow hydrologic and erosion processes at two woodlands 9-yr after burning. For untreated conditions, extensive bare interspace (87% bare ground) throughout the degraded intercanopy (69-88% bare ground) between trees at both sites promoted high runoff and sediment yield from combined rainsplash and sheetflow (similar to 45 mm, 59-381 g m(-2) ) and concentrated flow (371-501 L, 2343-3015 g) processes during high intensity rainfall simulation (102 mm h(-1) , 45 min) and overland flow experiments (15, 30, and 45 L min(-1) , 8 min each). Burning increased canopy cover of native perennial herbaceous vegetation by > 5-fold, on average, across both sites over nine growing seasons. Burning reduced low pre-fire sagebrush canopy cover ( < 1% to 14% average) at both sites and sagebrush recovery is expected to take > 30 yr. Enhanced herbaceous cover in interspaces post-fire reduced runoff and sediment yield from high intensity rainfall simulations by > 2-fold at both sites. Fire-induced increases in herbaceous canopy cover (from 34% to 62%) and litter ground cover (from 15% to 36%) reduced total runoff (from 501 L to 180 L) and sediment yield (from 2343 g to 115 g) from concentrated flow experiments in the intercanopy at one site. Sparser herbaceous vegetation (49% cover) and litter cover (8%) in the intercanopy at the other, more degraded site post-fire resulted in no significant reduction of total runoff (371 L to 266 L) and sediment yield (3015 g to 1982 g) for concentrated flow experiments. Areas underneath unburned shrub and tree canopies were well covered by vegetation and ground cover and generated limited runoff and sediment. Fire impacts on vegetation, ground cover, and runoff and sediment delivery from tree and shrub plots were highly variable. Burning litter covered areas underneath trees reduced perennial herbaceous vegetation and increased invasibility to the fire-prone annual cheatgrass (Bromus tectorum L.). Cheatgrass cover increased from < 1% prefire to 16-30%, on average, post-fire across the sites and was primarily restricted to areas around burned trees. High herbaceous cover (73%) under burned trees at the less degraded site resulted in similar low total runoff and sediment from concentrated flow experiments as prefire (136-228 L, 204-423 g). In contrast, fire-reduction of litter (from 79% to 49%) resulted in increased total runoff (from 103 L to 333 L) and sediment yield (from 619 g to 2170 g) from concentrated flow experiments in burned tree areas at the more degraded site. The experimental results demonstrate pinyon and juniper removal by prescribed fire can effectively re-establish a successional trajectory towards sagebrush steppe vegetation structure and thereby improve ecohydrologic function. Responses to burning at the more degraded site suggest results should be interpreted with caution however. Although burning substantially increased perennial grass cover and reduced fine-scale runoff and erosion at the more degraded site, poor sagebrush recovery, delayed litter recruitment, and persistent high concentrated flow erosion at that site suggest not all sites are good candidates for prescribed fire treatments. Furthermore, high levels of cheatgrass in burned tree areas (similar to 30% of area) at both sites increases wildfire risk, but cheatgrass is expected to decline over time in absence of fire. Our results in context with the literature suggest fire-surrogate tree-removal treatments (e.g., tree cutting or shredding) may be more appropriate on degraded sites with limited pre-treatment sagebrush and perennial herbaceous vegetation and that seeding may be necessary to improve post-fire establishment of sagebrush steppe vegetation structure and associated ecohydrologic function under these conditions. Lastly, vegetation, runoff, and erosion responses in this study are not directly applicable outside of the Great Basin, but similar responses in woodland studies from the southwestern US suggest potential application of results to woodlands in that region. The concept of re-establishing vegetation structure to improve ecohydrologic function is broadly applicable to sparsely vegetated lands around the World.",7,0,7,0,0,0,0,0,0,0,0,0,0,0,0,0,0,0,0,0,0,0,0,0,0,0,0,0,7,0,7,NA,NA
"9","10.2134/agronj1991.00021962008300010008x","THE ROTHAMSTED LONG-TERM EXPERIMENTS - ARE THEY STILL OF USE","The Rothamsted long-term experiments-the Classicals-were started almost 150 yr ago. These experiments were originally designed to study the N, P, K, Na, Mg, and Si needs of the field crops then grown in England. This was done by comparing these inorganic nutrients, in various combinations, with farmyard manure, the traditional source of fertility at that time. Although the questions the experiments were originally designed to answer have long been resolved, the experiments continue to give results of interest to agronomists, ecologists, soil scientists, plant pathologists, and others. The experiments show that grain yields can be sustained (and even increased) for almost 150 years in monocultures of wheat and barley given organic or inorganic fertilizer annually. They provide data on the long-term effects of inorganic fertilizers and organic manures on soil organic matter levels. These data have been used to test computer-based models for the turnover of organic matter in soil. Again, long-term N balances show that there are considerable inputs of N to the soil/plant system, amounting to some 30 kg N ha-1 yr-1 in unfertilized wheat and up to 65 kg ha-1 yr-1 in an arable soil reverting to woodland. These and other results are used to consider the advantages and disadvantages of long-term experiments. Wisely used, long-term experimental sites provide information on the long-term sustainability of agricultural systems that can be obtained in no other way.",7,0,7,0,0,0,0,0,0,0,0,0,0,0,0,0,0,0,0,0,0,0,0,0,0,0,0,0,7,0,7,NA,NA
"10","10.1002/2017JG003760","Understanding the effect of disturbance from selective felling on the carbon dynamics of a managed woodland by combining observations with model predictions","The response of forests and terrestrial ecosystems to disturbance is an important process in the global carbon cycle in the context of a changing climate. This study focuses on the effect of selective felling (thinning) at a managed forest site. Previous statistical analyses of eddy covariance data at the study site had found that disturbance from thinning resulted in no significant change to net ecosystem carbon uptake. In order to better understand the effect of thinning on carbon fluxes, we use the mathematical technique of four-dimensional variational data assimilation. Data assimilation provides a compelling alternative to more common statistical analyses of flux data as it allows for the combination of many different sources of data, with the physical constraints of a dynamical model, to find an improved estimate of the state of a system. We develop new observation operators to assimilate daytime and nighttime net ecosystem exchange observations with a daily time step model, increasing observations available by a factor of 4.25. Our results support previous analyses, with a predicted net ecosystem carbon uptake for the year 2015 of 426 116gCm(-2) for the unthinned forest and 420 78gCm(-2) for the thinned forest despite a model-predicted reduction in gross primary productivity of 337gCm(-2). We show that this is likely due to reduced ecosystem respiration postdisturbance compensating for a reduction in gross primary productivity. This supports the theory of an upper limit of forest net carbon uptake due to the magnitude of ecosystem respiration scaling with gross primary productivity. Plain Language Summary Forests play an important role in the global carbon cycle, removing large amounts of CO2 from the atmosphere and thus helping to mitigate the effect of human-induced climate change. The response of forest ecosystem carbon dynamics to disturbance events (e.g., fire, felling, and insect outbreak) is not well understood. Many observations are currently made that give us insight into the processes occurring in forests; however, there are many processes that we cannot observe. Therefore, we must use mathematical models of forest carbon balance to better understand underlying behaviors; however, these models are often subject to large errors. In this study we use advanced mathematical techniques to combine information from both observations and model predictions of forest carbon balance, to improve current estimates and better understand the effect of disturbance from selective felling at a managed woodland. We find no significant change to the total forest carbon uptake after approximately 46% of trees are removed from the woodland. Our best modeled estimates suggest that this is due to photosynthesis being the main driver for ecosystem respiration, so that reducing the number of trees has reduced carbon uptake from photosynthesis but concurrently reduced respiration, meaning total carbon uptake is not significantly affected.",0,5,5,1,0,1,0,0,0,0,0,0,0,0,0,0,0,0,0,0,0,0,0,0,0,0,0,0,6,0,6,NA,NA
"11","10.1002/ece3.6072","Critical transitions in rainfall manipulation experiments on grasslands","As a result of climate and land-use changes, grasslands have been subjected to intensifying drought regimes. Extreme droughts could interfere in the positive feedbacks between grasses and soil water content, pushing grasslands across critical thresholds of productivity and leading them to collapse. If this happens, systems may show hysteresis and costly management interventions might be necessary to restore predrought productivity. Thus, neglecting critical transitions may lead to mismanagement of grasslands and to irreversible loss of ecosystem services. Rainfall manipulation experiments constitute a powerful approach to investigate the risk of such critical transitions. However, experiments performed to date have rarely applied extreme droughts and have used resilience indices that disregard the existence of hysteresis. Here, we suggest how to incorporate critical transitions when designing rainfall manipulation experiments on grasslands and when measuring their resilience to drought. The ideas presented here have the potential to trigger a perspective shift among experimental researchers, into a new state where the existence of critical transitions will be discussed, experimentally tested, and largely considered when assessing and managing vegetation resilience to global changes.",5,0,5,0,1,1,0,0,0,0,0,0,0,0,0,0,0,0,0,0,0,0,0,0,0,0,0,0,6,0,6,NA,NA
"12","10.1016/j.foreco.2017.12.045","Experimental drought and plant invasion additively suppress primary pine species of southeastern US forests","Climate change and non-native invasive species are two predominant drivers of global environmental change, yet little is known about how they might interact to affect native communities and ecosystems. Drought and plant invasions are intensifying in ecosystems worldwide, including ecologically and economically important pine forests of the southeastern United States. These stressors can alter resource availability and plant competition outcomes, and may together exert additive, synergistic, or offsetting effects on native species, but such outcomes are difficult to predict. We used a factorial common garden experiment to determine how simulated drought, invasion by Imperata cylindrica (cogongrass), and their interaction affected seedling survival and performance (relative growth rates of height and diameter, and biomass) of two native pine species, Pinus elliottii var. densa (South Florida slash pine) and Pinus taeda (loblolly pine). In general, loblolly pine outperformed slash pine over the course of the experiment, but the directions and magnitudes of each species' responses to the treatments were similar, with the two stressors often exhibiting additive negative effects on pine seedling performance. For both species, invasion significantly suppressed seedling survival, drought reduced relative growth rates in height, and drought and invasion had an additive negative effect on diameter compared to ambient conditions with resident plant communities. The suppressive effects of drought on these primary pine species suggests that increasing drought in the region could scale up to affect forest stand dynamics. Furthermore, the experimental demonstration of cogongrass impacts on pine seedling survival and performance should further motivate land owners and property managers to remove this noxious invasive species. To predict the long-term outcome of drought and invasion on forest stands, and more broadly on vegetation dynamics in ecosystems affected by these global change agents, additional evaluations of their separate and interactive effects are needed. Nonetheless, these results experimentally demonstrate that stress from experimental drought combined with competition from an aggressive grass invader can significantly suppress seedlings of primary pine species of southeastern US forests.",5,0,5,0,1,1,0,0,0,0,0,0,0,0,0,0,0,0,0,0,0,0,0,0,0,0,0,0,6,0,6,NA,NA
"13","10.1111/1365-2435.13875","Functional diversity response to geographic and experimental precipitation gradients varies with plant community type","Precipitation is a primary determinant of plant community structure in drylands. However, the empirical evidence and predictions are lacking for how plant functional diversity in desert and steppe communities respond to altered precipitation regimes. We examined how precipitation changes along the natural and experimental gradients affect different components of functional diversity in desert-shrub and steppe-grass communities. We compared the associations of precipitation changes with community-weighted means (CWMs) of six traits, functional divergence (FDvar) of each single-trait and multi-trait functional richness (FRic) and dispersion (FDis) for shrub and grass communities along the natural and experimental gradients. We also disentangle the roles of species turnover and intraspecific variations in affecting the responses of different functional diversity to precipitation changes. We found that in general, the similar responses of functional traits or diversity to both the natural and experimental precipitation gradients were dependent on plant community type. Across both two gradients, precipitation was positively associated with CWM of plant height and negatively associated with the CWM of SLA and leaf thickness in grass community, while positively associated with FDvar of four traits and FDis in shrub communities. Both species turnover and intraspecific variations contributed to the responses of grass community traits to precipitation changes across both two gradients, and to FDvar of traits and FDis in shrub community along the natural gradient. In contrast, species turnover variations contributed to FDvar of traits and FDis in shrub community in experiment. These results suggest that there is better concordance between the effects of naturally and experimentally increased precipitation on functional diversity of plant communities, but different mechanisms behind the relationship of functional diversity-precipitation between shrub and grass communities. Grass communities can adapt to precipitation changes by average trait differences, while shrub communities persist through FDvar of single-trait and multi-trait dispersion, thus highlighting the important differences in adaptive strategies between shrub and grass communities. Our findings demonstrate that short-term responses of plant communities to manipulative precipitation changes can reflect long-term shifts at spatial scales depending on the specific functional trait and diversity. A free Plain Language Summary can be found within the Supporting Information of this article.",5,0,5,0,1,1,0,0,0,0,0,0,0,0,0,0,0,0,0,0,0,0,0,0,0,0,0,0,6,0,6,NA,NA
"14","10.5194/acp-9-2619-2009","Estimating surface CO2 fluxes from space-borne CO2 dry air mole fraction observations using an ensemble Kalman Filter","We have developed an ensemble Kalman Filter (EnKF) to estimate 8-day regional surface fluxes of CO2 from space-borne CO2 dry-air mole fraction observations (X-CO2) and evaluate the approach using a series of synthetic experiments, in preparation for data from the NASA Orbiting Carbon Observatory (OCO). The 32-day duty cycle of OCO alternates every 16 days between nadir and glint measurements of backscattered solar radiation at short-wave infrared wavelengths. The EnKF uses an ensemble of states to represent the error covariances to estimate 8-day CO2 surface fluxes over 144 geographical regions. We use a 12 x 8-day lag window, recognising that X-CO2 measurements include surface flux information from prior time windows. The observation operator that relates surface CO2 fluxes to atmospheric distributions of X-CO2 includes: a) the GEOS-Chem transport model that relates surface fluxes to global 3-D distributions of CO2 concentrations, which are sampled at the time and location of OCO measurements that are cloud-free and have aerosol optical depths <0.3; and b) scene-dependent averaging kernels that relate the CO2 profiles to X-CO2, accounting for differences between nadir and glint measurements, and the associated scene-dependent observation errors. We show that OCO X-CO2 measurements significantly reduce the uncertainties of surface CO2 flux estimates. Glint measurements are generally better at constraining ocean CO2 flux estimates. Nadir X-CO2 measurements over the terrestrial tropics are sparse throughout the year because of either clouds or smoke. Glint measurements provide the most effective constraint for estimating tropical terrestrial CO2 fluxes by accurately sampling fresh continental outflow over neighbouring oceans. We also present results from sensitivity experiments that investigate how flux estimates change with 1) bias and unbiased errors, 2) alternative duty cycles, 3) measurement density and correlations, 4) the spatial resolution of estimated flux estimates, and 5) reducing the length of the lag window and the size of the ensemble. At the revision stage of this manuscript, the OCO instrument failed to reach its orbit after it was launched on 24 February 2009. The EnKF formulation presented here is also applicable to GOSAT measurements of CO2 and CH4.",2,3,5,1,0,1,0,0,0,0,0,0,0,0,0,0,0,0,0,0,0,0,0,0,0,0,0,0,6,0,6,"Lukas","No"
"15","no doi","The original USDA-ARS experimental watersheds in Texas and Ohio: Contributions from the past and visions for the future","The USDA Soil Conservation Service (USDA-SCS) realized the importance of understanding hydrologic processes on agricultural fields and watersheds in the mid-1930s. Based on this realization, the research program of the Hydrologic Division of SCS established three experimental watersheds across the U.S. to analyze the impact of landuse practices on soil erosion, flood events, water resources, and the agricultural economy. Two of the original watersheds remain in operation today within the USDA Agricultural Research Service (USDA-ARS): the Blacklands Experimental Watershed (now the Grassland, Soil and Water Research Laboratory) near Riesel, Texas, and the North Appalachian Experimental Watershed near Coshocton, Ohio. These original watersheds were designed for collection of hydrologic data on small watersheds and evaluation of hydrologic and soil loss response as influenced by various agricultural land management practices. A major contribution of these experimental watersheds is the quantification of soil loss reduction under conservation management, which has led to a drastic reduction in soil loss from cultivated agriculture in the 20th century. Riesel watershed studies produced the scientific basis for several watershed models that are now used worldwide to manage water quality and also facilitated fundamental analysis of the agronomic and environmental effects of tillage, fertilizer, and pesticide alternatives. Coshocton watershed studies led to the development of no-till and pasture management practices to control runoff, erosion, and chemical loss and were instrumental in understanding water quality and hydrologic effects of soil macropores and mining and reclamation activities. The long-term hydrologic records at each site have also improved understanding and management of water resources in their respective geographic regions. Because of their historical and future value, the USDA-ARS has a unique responsibility to maintain these long-term experimental watersheds, which are vital for addressing emerging research needs to meet future water availability, environmental quality, and food and fiber demands.",5,0,5,0,1,1,0,0,0,0,0,0,0,0,0,0,0,0,0,0,0,0,0,0,0,0,0,0,6,0,6,"Lau","No"
